### ISSUE TITLE
Honeymap Issue

### ISSUE THREAD

**Issue by turbowrx03** [threatstream/mhn#246]
If i am on http://ipaddress/ui/dashboard and i click on "map" i just get "Not Found" on the page. Any ideas?

**Comment by jt6211** [comment]
View the `/opt/mhn/server/config.py` file, make sure that `HONEYMAP_URL` has the same IP as your MHN server AND make sure the port is set to 3000.  If you change this file you will need to restart the mhn wsgi server like this:

```
sudo supervisorctl restart mhn-uwsgi
```

**Comment by turbowrx03** [comment]
Thanks. I didnt notice my typo there. It's working now but i dont see any of my honeypots on the map.

**Comment by jt6211** [comment]
Any chance your honeypots have private IPs?  These won't render on the map.

**Comment by turbowrx03** [comment]
They do. They point to the MHN server externally and have NAT rules in place. Will this not work?

**Comment by jt6211** [comment]
Only if you follow this: https://github.com/threatstream/mhn/wiki/Customizing-Maxmind-IP-Geo-DB-for-Internal-Networks

**Comment by turbowrx03** [comment]
So on my MHN server i can see my sensors with public IPs. But i do not see them on the map. Do i still need to follow that tutorial? Should they show up even though there hasnt been any alerts?

**Comment by turbowrx03** [comment]
Follow up. The MHN Server sees the honeypots public ips, and i see attacks coming in, but i still dont see them on the map. 
I therefor tried your steps in the link you provided and i still have nothing on the map..

**Comment by jt6211** [comment]
Ok, some more questions to clarify.

1. Are you seeing data in the MHN attacks page?  If not, are they in a place where they would see traffic?
2. What types of honeypots did you deploy?
3. Are you seeing anything at all on the map?  (just red dots, just yellow dots, no dots at all)
4. What is the output of running this command on your MHN server: `sudo supervisorctl status`

**Comment by turbowrx03** [comment]
1. Are you seeing data in the MHN attacks page? If not, are they in a place where they would see traffic? Yes, i can see all attacks in attack page.
   2. What types of honeypots did you deploy? Dionaea, snort, and kippo.
   3. Are you seeing anything at all on the map? (just red dots, just yellow dots, no dots at all) Nothing at all. No red, no yellow, nothing.
   4. What is the output of running this command on your MHN server: sudo supervisorctl status? 
geoloc                           RUNNING    pid 1112, uptime 3 days, 18:04:40
honeymap                         RUNNING    pid 1077, uptime 3 days, 18:04:40
hpfeeds-broker                   RUNNING    pid 1179, uptime 3 days, 18:04:39
hpfeeds-logger-json              RUNNING    pid 1166, uptime 3 days, 18:04:40
kibana                           RUNNING    pid 1068, uptime 3 days, 18:04:40
logstash                         RUNNING    pid 26799, uptime 3 days, 18:04:40
mhn-celery-beat                  RUNNING    pid 1065, uptime 3 days, 18:04:40
mhn-celery-worker                RUNNING    pid 4069, uptime 3 days, 17:35:44
mhn-collector                    RUNNING    pid 1174, uptime 3 days, 18:04:40
mhn-uwsgi                        RUNNING    pid 1143, uptime 3 days, 18:04:40
mnemosyne                        RUNNING    pid 1061, uptime 3 days, 18:04:40

**Comment by turbowrx03** [comment]
Any other ideas?

**Comment by jt6211** [comment]
Can you do this?  On your MHN server

```
sudo tcpdump -A -nnNN 'tcp port 10000' | grep -o '\{.*' --line-buffered
```

You should see some packets with JSON data.  Can you look at the IP address in the JSON data?  Are these public IPs or private IPs?  If they are private then you won't see anything on the map.  If they are public then there is another issue.

**Comment by jtsamas** [comment]
I decided to have a fresh installation given the switch to GeoLite2 database set for geolocation meant my first installation stopped showing attackes on the map

I can see the ATTACK events under VIEW sensor however nothing popping on my map .

http://hornet.cirt.zm:3000/

aM I seeing data in the MHN attacks page? If not, are they in a place where they would see traffic?
Yes, i can see all attacks in attack page.

What types of honeypots did you deploy?
snort

Am i seeing anything at all on the map? (just red dots, just yellow dots, no dots at all)
Nothing at all. No red, no yellow, nothing.

What is the output of running this command on your MHN server: sudo supervisorctl status?

sudo supervisorctl status

geoloc RUNNING pid 1769, uptime 0:36:40
honeymap RUNNING pid 1775, uptime 0:36:40
hpfeeds-broker RUNNING pid 1767, uptime 0:36:40
mhn-celery-beat RUNNING pid 1766, uptime 0:36:40
mhn-celery-worker RUNNING pid 1772, uptime 0:36:40
mhn-collector RUNNING pid 1774, uptime 0:36:40
mhn-uwsgi RUNNING pid 1771, uptime 0:36:40
mnemosyne RUNNING pid 1768, uptime 0:36:40
snort RUNNING pid 1770, uptime 0:36:40

the command below generates the desired result

sudo tcpdump -nnNN tcp port 10000
tcpdump: verbose output suppressed, use -v or -vv for full protocol decode
listening on eth0, link-type EN10MB (Ethernet), capture size 262144 bytes
15:48:36.359945 IP 10.2.2.74.48602 > 18.210.49.141.10000: Flags [.], ack 281848156, win 229, options [nop,nop,TS val 3655168 ecr 1745097637], length 0
15:48:36.642497 IP 18.210.49.141.10000 > 10.2.2.74.48602: Flags [.], ack 1, win 210, options [nop,nop,TS val 1745116581 ecr 3368341], length 0
15:49:52.135934 IP 10.2.2.74.48602 > 18.210.49.141.10000: Flags [.], ack 1, win 229, options [nop,nop,TS val 3674112 ecr 1745116581], length 0
15:49:52.418401 IP 18.210.49.141.10000 > 10.2.2.74.48602: Flags [.], ack 1, win 210, options [nop,nop,TS val 1745135524 ecr 3368341], length 0

Running the set up on 16.04; I have a static I.P pointing to test server configured with a private I.P inside my network... For test purpose , I have configured a snort sensor on the same machine. (This worked before I made the update to the new installation of MHN...)

Help please
nawajoel [at] gmail [dot] com
