### ISSUE TITLE
No Events on Honeymap after New installation - #troubleshooting

### ISSUE THREAD

**Issue by jtsamas** [threatstream/mhn#664]
I decided to have a fresh installation given  the switch to GeoLite2 database set for geolocation meant my first installation stopped showing attackes on the map 

I can see the ATTACK events under VIEW sensor however nothing popping on my map .

- aM I seeing data in the MHN attacks page? If not, are they in a place where they would see traffic?
Yes, i can see all attacks in attack page.

- What types of honeypots did you deploy?
snort

- Am i seeing anything at all on the map? (just red dots, just yellow dots, no dots at all)
Nothing at all. No red, no yellow, nothing.

What is the output of running this command on your MHN server: sudo supervisorctl status?

sudo supervisorctl status

geoloc                           RUNNING   pid 1769, uptime 0:36:40
honeymap                         RUNNING   pid 1775, uptime 0:36:40
hpfeeds-broker                   RUNNING   pid 1767, uptime 0:36:40
mhn-celery-beat                  RUNNING   pid 1766, uptime 0:36:40
mhn-celery-worker                RUNNING   pid 1772, uptime 0:36:40
mhn-collector                    RUNNING   pid 1774, uptime 0:36:40
mhn-uwsgi                        RUNNING   pid 1771, uptime 0:36:40
mnemosyne                        RUNNING   pid 1768, uptime 0:36:40
snort                            RUNNING   pid 1770, uptime 0:36:40

the command below generates the desired  result 

 sudo tcpdump -nnNN tcp port 10000
tcpdump: verbose output suppressed, use -v or -vv for full protocol decode
listening on eth0, link-type EN10MB (Ethernet), capture size 262144 bytes
15:48:36.359945 IP 10.2.2.74.48602 > 18.210.49.141.10000: Flags [.], ack 281848156, win 229, options [nop,nop,TS val 3655168 ecr 1745097637], length 0
15:48:36.642497 IP 18.210.49.141.10000 > 10.2.2.74.48602: Flags [.], ack 1, win 210, options [nop,nop,TS val 1745116581 ecr 3368341], length 0
15:49:52.135934 IP 10.2.2.74.48602 > 18.210.49.141.10000: Flags [.], ack 1, win 229, options [nop,nop,TS val 3674112 ecr 1745116581], length 0
15:49:52.418401 IP 18.210.49.141.10000 > 10.2.2.74.48602: Flags [.], ack 1, win 210, options [nop,nop,TS val 1745135524 ecr 3368341], length 0

Running the set up on 16.04; I have a static I.P pointing to test server configured with a private I.P inside my network... For test purpose , I have configured a snort sensor on the same machine. (This worked before I made the update to the new installation of MHN...)

Help please
nawajoel [at] gmail [dot] com

**Comment by nitrogen17** [comment]
Totally same problem here, I think the problem points to the geolite2 database. I also see Attacks on my MHN server except it didnt render to the Honeymap.

Here's my error.

**mhn-collector.log**

`019-06-18 01:49:49,317 - collector - ERROR - 'Location' object has no attribut$
Traceback (most recent call last):

  File "collector_v2.py", line 98, in on_message
    results = processor.process(identifier, channel, payload, ignore_errors=Tru$
  File "/opt/mhn/env/src/hpfeeds-logger/hpfeedslogger/processors.py", line 631,$
    self.geo_intelligence_enrichment(results)
  File "/opt/mhn/env/src/hpfeeds-logger/hpfeedslogger/processors.py", line 607,$
    src_geo = geo_intel(self.maxmind_geo, self.maxmind_asn, message.get('src_ip$
  File "/opt/mhn/env/src/hpfeeds-logger/hpfeedslogger/processors.py", line 77, $
    result['lattitude'] = geo.location.lattitude

AttributeError: 'Location' object has no attribute 'lattitude'
`

Im not sure if the error is connected to **"no events on honeymap"**. Hoping that anyone will help us :(

**Comment by d1str0** [comment]
hpfeeds-logger had a typo. I have since fixed it. 

The following steps *should* fix it.

`sudo /opt/mhn/env/bin/pip install git+git://github.com/threatstream/hpfeeds-logger@master`

If this doesn't work, you might have to first `sudo rm -rf /opt/mhn/env/src/hpfeeds-logger` and then run pip install.

**Comment by d1str0** [comment]
And then restart all your services with `sudo supervisorctl restart all`

**Comment by jtsamas** [comment]
I did not do a fresh installation however I followed the instructions given by @d1str0 . Unfortunately I only got this error

mhn-collector: ERROR

Looking at my logs in mhn-collector.log and mhn-collector.err

sudo tail /var/log/mhn/mhn-collector.log
File "/opt/mhn/env/src/hpfeeds-logger/hpfeedslogger/processors.py", line 77, in geo_intel
AttributeError: 'Location' object has no attribute 'lattitude'
2019-06-20 14:32:51,633 - collector - ERROR - 'Location' object has no attribute 'lattitude'
Traceback (most recent call last):
File "collector_v2.py", line 100, in on_message
results = processor.process(identifier, channel, payload, ignore_errors=True)
File "/opt/mhn/env/src/hpfeeds-logger/hpfeedslogger/processors.py", line 631, in process
File "/opt/mhn/env/src/hpfeeds-logger/hpfeedslogger/processors.py", line 607, in geo_intelligence_enrichment
File "/opt/mhn/env/src/hpfeeds-logger/hpfeedslogger/processors.py", line 77, in geo_intel
AttributeError: 'Location' object has no attribute 'lattitude'

sudo tail /var/log/mhn/mhn-collector.err
src_ip=dec.src_ip,
^
SyntaxError: invalid syntax
Traceback (most recent call last):
File "collector_v2.py", line 5, in 
from hpfeedslogger import processors
File "/opt/mhn/env/local/lib/python2.7/site-packages/hpfeedslogger/processors.py", line 166
src_ip=dec.src_ip,
^
SyntaxError: invalid syntax

sudo supervisorctl restart all

mhn-collector: ERROR (spawn error)
cowrie: ERROR (spawn error)
suricata: started
snort: started
mhn-celery-beat: started
hpfeeds-broker: started
mnemosyne: started
geoloc: started
mhn-uwsgi: started
mhn-celery-worker: started
honeymap: started

**Comment by nitrogen17** [comment]
> "The address %s is not in the database." % ip_address)
> AddressNotFoundError: The address 10.2.2.74 is not in the database.
> invalid message {"sensor": "21d0126a-8f53-11e9-a264-d4ae52c399cf", "timestamp": "2019/06/20 16:16:13.146814", "tcp_seq": "0xC0B4F9C", "proto": "TCP", "ip_tos": 0, "destination_ip": "10.2.2.74", "source_ip": "185.176.26.27", "ip_ttl": 238, "ip_id": 62164, "eth_src": "50:57:A8:D4:A5:84", "eth_dst": "D4:AE:52:C3:99:CF", "tcp_len": 20, "eth_type": "0x800", "eth_len": "0x3C", "tcp_ack": "0x0", "tcp_win": "0x4000000", "source_port": 42837, "signature_id": 2402000, "destination_port": 3333, "tcp_flags": "*****S", "action": "allowed", "signature_rev": 5189, "signature": "ET DROP Dshield Block Listed Source group 1"} ****
> Traceback (most recent call last):
> File "/opt/hpfeeds/examples/geoloc/geoloc.py", line 84, in


 "destination_ip": "10.2.2.74", "source_ip": "185.176.26.27"

It seems that your destination IP is private, just try to use both public IP in mhn server and sensor.
